685,Tamsulosin Reduces Nighttime Urine Production in Benign Prostatic Hyperplasia Patients with Nocturnal Polyuria: A Prospective Open-Label Long-Term Study Using Frequency-Volume Chart,http://www.siucongress.org/eipdf/siu2012Abstract01020.pdf,Makoto Imura,Yoshiyuki Kojima,Takashi Hamakawa,Yashuhiro Shibata,Yasue Kubota,Shoichi Sasaki,Yutaro Hayashi,Kenjiro Kohri,,,,,,,,,,,,
686,Robot-Assisted Radical Cystectomy with Intracorporeal Neobladder Construction,http://www.siucongress.org/eipdf/siu2012Abstract01021.pdf,Arvind Ganpule,Amit Doshi,Shashikant Mishra,Ravindra Sabnis,Mihir Desai,Mahesh Desai,,,,,,,,,,,,,,
688,Is Hypertension Associated with Increased Urinary Calcium Excretion in Patients with Nephrolithiasis?,http://www.siucongress.org/eipdf/siu2012Abstract01023.pdf,Kim Drasa,Petrit Bara,Roland Katroshi,Aurora Xhixha,,,,,,,,,,,,,,,,
689,The Usefulness of Time-Resolved Three-Dimensional Phase-Contrast MRI Using PC-VIPR in Renal Transplantation,http://www.siucongress.org/eipdf/siu2012Abstract01024.pdf,Ishii Yasuo,Takehara Yasuo,Masao Ngata,Takayuki Sugiyama,Atsushi Otsuka,Tatsuya Takayama,Hiroshi Furuse,Soichi Mugiya,Tetsuya Wakayama,Kevin Johonson,Oliver Wieben,Seiichiro Ozono,,,,,,,,
690,The Effects of Zoledronic Acid Therapy on Bone Metabolic Indicators Can Be Assessed Not Only in Prostate but Also Kidney Cancer Patients with Bone Metastasis,http://www.siucongress.org/eipdf/siu2012Abstract01025.pdf,Satoshi Anai,Nakai Yasushi,Miyake Makito,Chihara Yoshitomo,Tanaka Nobumichi,Fujimoto Kiyohide,Hirao Yoshihiko,,,,,,,,,,,,,
691,Follicle-Stimulating Hormone (FSH) Correlates Pathologically Invasiveness of Prostate Cancer,http://www.siucongress.org/eipdf/siu2012Abstract01026.pdf,Hisamitsu Ide,Yuichi Terado,Jingsong Yu,Yan Lu,Kentaro Sakamaki,Schinichi Hisasue,Shyuji Isotani,Raizo Yamaguchi,Satoru Muto,Shigeo Horie,,,,,,,,,,
692,Retroperitoneoscopy for the Treatment of Ureteral Stones,http://www.siucongress.org/eipdf/siu2012Abstract01027.pdf,Alireza Farshi Haghro,Mohsen Amjadi,,,,,,,,,,,,,,,,,,
693,The Effect of Prostate Size on the Short Term Outcome of Thulium:YAG (Revolixr) Vaporesection or Vapoenucleation for the Treatment of Benign Prostatic Hyperplasia,http://www.siucongress.org/eipdf/siu2012Abstract01028.pdf,Jae Seung Chung,Cheol Kyu Oh,Seong Cheol Kim,Sang Hyun Park,Jun Ho Choi,Jang Ho Yoon,Dong Il Kang,Kweon Sik Min,Jae Il Chung,,,,,,,,,,,
694,Ureteroscopy-Assisted Retrograde Nephrostomy (UARN) for Percutaneous Nephrolithotomy (PCNL),http://www.siucongress.org/eipdf/siu2012Abstract01029.pdf,Takashi Kawahara,Hiroki Ito,Hideyuki Terao,Takehiko Ogawa,Hiroji Uemura,Yoshinobu Kubota,Junichi Matsuzaki,,,,,,,,,,,,,
695,Learning Curve for Robotic Assisted Radical Prostatectomy (RARP): MPUH Experience,http://www.siucongress.org/eipdf/siu2012Abstract01030.pdf,Jigish Vyas,Arvind Ganpule,Shashikant Mishra,Raghuram,Ravindra Sabnis,M R Desai,,,,,,,,,,,,,,
696,Prospective Randomized Study to Compare Safety and Efficacy of Micro Percutaneous Nephrolithotomy (Micro Perc) in Comparison to Retrograde Intra Renal Surgery (RIRS),http://www.siucongress.org/eipdf/siu2012Abstract01031.pdf,Jigish Vyas,Amit Doshi,Arvind Ganpule,Shashikant Mishra,Raghuram,Ravindra Sabnis,M R Desai,,,,,,,,,,,,,
697,Elucidation of Metabolic Syndrome-Related Paracrine System by Co-Culturing Renal Tubular Epithelial Cells and Adipocytes,http://www.siucongress.org/eipdf/siu2012Abstract01032.pdf,Yasuhiro Fujii,Atsushi Okada,Jun Ichikawa,Kazumi Taguchi,Yasuhiko Hirose,Shuzo Hamamoto,Takahiro Yasui,Yasunori Itoh,Keiichi Tozawa,Kenjiro Kohri,,,,,,,,,,
698,Surgical and Functional Outcomes of Repeat Partial Nephrectomy on a Solitary Kidney,http://www.siucongress.org/eipdf/siu2012Abstract01033.pdf,Kazuhiko Yoshida,Tunenori Kondo,Toshio Takagi,Jyunpei Iiduka,Kenji Omae,Eri Ikezawa,Taiji Nozaki,Hirohito Kobayashi,Kazunari Tanabe,,,,,,,,,,,
699,Adiponectin Ameliorates Kidney Stone Formation in Metabolic Syndrome Model Mice,http://www.siucongress.org/eipdf/siu2012Abstract01034.pdf,Yasuhiro Fujii,Atsushi Okada,Takahiro Kobayashi,masayuki Usami,Shuzo Hamamoto,Masahito Hirose,Takahiro Yasui,Yasunori Itoh,Keiichi Tozawa,Kenjiro Kohri,,,,,,,,,,
700,CT Virtual Cystoscopy in Evaluation of Bladder Mass: Could it Replace the Gold Standard Conventional Cystoscopy?,http://www.siucongress.org/eipdf/siu2012Abstract01035.pdf,Ahmed Gabr,Mohamed Elbadry,Ashraf Elsherif,Ehab Tawfiek,,,,,,,,,,,,,,,,
703,The Comparison Between Efficacy of Tamsulosin Alone or in Combination with Corticosteroids vs Corticosteroids Alone vs Analgesics in Spontaneous Passage of Distal Ureteral Stones: Results of a Prospec,http://www.siucongress.org/eipdf/siu2012Abstract01038.pdf,Maurizio Brausi,Giovanni Luca Giliberto,Ivano Vavassori,Silvia La Vecchia,,,,,,,,,,,,,,,,
705,Development of Endoscopic Hybrid Therapy for Renal Calculi Using the Prone Split-Leg Position: Simultaneous Use of Flexible Ureteroscopy and Mini-Percutaneous Nephrolithotomy,http://www.siucongress.org/eipdf/siu2012Abstract01040.pdf,Shuzo Hamamoto,Takahiro Yasui,Atsushi Okada,Kazuhiro Niimi,Kazumi Taguchi,Keiichi Tozawa,Kenjiro Kohri,,,,,,,,,,,,,
707,Antigen-Specific Induction of Thrombin-Cleaved Form of Osteopontin Contributes to Inhibit Renal Stone Formation,http://www.siucongress.org/eipdf/siu2012Abstract01042.pdf,Shuzo Hamamoto,Takahiro Yasui,Atsushi Okada,Kazuhiro Niimi,Keiichi Tozawa,Kenjiro Kohri,,,,,,,,,,,,,,
708,Angiogenesis Comparison between BPH and Prostate Cancer Using Immunohistochemical Methods,http://www.siucongress.org/eipdf/siu2012Abstract01043.pdf,Nikolaos Grivas,Anna Goussia,Dimitrios Stefanou,Dimitrios Giannakis,,,,,,,,,,,,,,,,
709,Is Laparoscopic Living Donor Nephrectomy in Patients with Vascular Anomalies Safe and Effective?,http://www.siucongress.org/eipdf/siu2012Abstract01044.pdf,Alessandro Volpe,Elisa De Lorenzis,Roberto Tarabuzzi,Davide Giraudo,Paolo De Angelis,Marco Quaglia,Monica Zacchero,Francesco Varvello,Piero Stratta,Carlo Terrone,,,,,,,,,,
710,Chronic Kidney Disease after Urolithiasis Treated Successfully by Shock Wave Lithotripsy Is Strong Risk Factor for Cardiovascular Disease,http://www.siucongress.org/eipdf/siu2012Abstract01045.pdf,Taro Iguchi,Kazuaki Kita,Yoshiko Kamada,Takeshi Yamasaki,Satoshi Tamada,Toshihide Naganuma,Junji Uchida,Katsuyuki Kuratsukuri,Hidenori Kawashima,Tatsuya Nakatani,,,,,,,,,,
711,Assessment of Predictive Factors of Urological Complications in a Consecutive Series of 738 Renal Transplants at a Single Centre,http://www.siucongress.org/eipdf/siu2012Abstract01046.pdf,Alessandro Volpe,Elisa De Lorenzis,Monica Zacchero,Marco Quaglia,Filippo Sogni,Francesco Varvello,Paolo De Angelis,Davide Giraudo,Piero Stratta,Carlo Terrone,,,,,,,,,,
712,Perioperative Morbidity and Mortality Related to Radical Cystectomy: A Multi-institutional Retrospective Study in Japan,http://www.siucongress.org/eipdf/siu2012Abstract01047.pdf,Norikata Takada,Takashige Abe,Nobuo Shinohara,Ataru Sazawa,Satoru Maruyama,Toshimori Seki,Masaki Togashi,Katsuya Nonomura,,,,,,,,,,,,
713,Trends in Partial Nephrectomy Use in Italy: Data from the Piedmont Region in the Last Decade,http://www.siucongress.org/eipdf/siu2012Abstract01048.pdf,Alessandro Volpe,Paolo De Angelis,Antonia Di Domenico,Luisa Zegna,Paolo Mondino,Elisa De Lorenzis,Carlo Terrone,,,,,,,,,,,,,
715,Trends in the Use of Laparoscopy for Surgical Treatment of Renal Tumors in Italy: Data from the Piedmont Region in the Last Decade,http://www.siucongress.org/eipdf/siu2012Abstract01050.pdf,Alessandro Volpe,Paolo De Angelis,Paolo Mondino,Antonia Di Domenico,Luisa Zegna,Elisa De Lorenzis,Roberto Tarabuzzi,Carlo Terrone,,,,,,,,,,,,
716,Genital Flaps for Urethral Lengthening in Female Transsexuals with Total Phalloplasty,http://www.siucongress.org/eipdf/siu2012Abstract01051.pdf,Miroslav Djordjevic,Marta Bizic,Marko Majstorovic,Vladimir Kojovic,Gradimir Korac,,,,,,,,,,,,,,,
717,Laparoscopic Adrenalectomy for Adrenal Myelolipoma: Case Series Analysis,http://www.siucongress.org/eipdf/siu2012Abstract01052.pdf,Jhih-Cheng Wang,Steven K. Huan,Allen W. Chiu,,,,,,,,,,,,,,,,,
718,Fistula Prevention by Longitudinal Dorsal Dartos Flap Covering in Proximal Snodgrass Hypospadias Repair,http://www.siucongress.org/eipdf/siu2012Abstract01053.pdf,Miroslav Djordjevic,Marko Majstorovic,Marta Bizic,Gradimir Korac,Vojkan Vukadinovic,Zoran Krstic,,,,,,,,,,,,,,
719,Sigmoid Vaginoplasty After Failed Sex Reassignment Surgery in Male Transsexuals,http://www.siucongress.org/eipdf/siu2012Abstract01054.pdf,Miroslav Djordjevic,Marta Bizic,Dusan Stanojevic,,,,,,,,,,,,,,,,,
720,Substitute Flap-Graft Urethroplasty for Obliterative Anterior Urethral Strictures: One Stage Repair,http://www.siucongress.org/eipdf/siu2012Abstract01055.pdf,Miroslav Djordjevic,Vladimir Kojovic,Marta Bizic,Cano Tulic,,,,,,,,,,,,,,,,
722,Functional Results and Oncological Outcome of Radical Prostatectomy Used as a Primary Treatment in Locally Advanced Prostate Cancer,http://www.siucongress.org/eipdf/siu2012Abstract01057.pdf,Alexander Hinev,Deyan Anakievski,Vesselin Hadjiev,Angel Angelov,Lena Marinova,Dimiter Kalev,,,,,,,,,,,,,,
723,Gender-Specific Conservative Management of the Overactive Bladder in a Population-Based Survey,http://www.siucongress.org/eipdf/siu2012Abstract01058.pdf,Jan Svihra,Ivana Zigova,Milan Svec,Eva Sulcova,,,,,,,,,,,,,,,,
724,Prospective Multicenter Evaluation of PCA3 and TMPRSS2-ERG Gene Fusions as Diagnostic and Prognostic Biomarkers for Prostate Cancer,http://www.siucongress.org/eipdf/siu2012Abstract01059.pdf,Gisele Leyten,Daphne Hessels,Erik Cornel,Theo de Reyke,Henk Vergunst,Paul Kil,Ben Knipscheer,Inge van Oort,Peter Mulders,Jack Schalken,,,,,,,,,,
725,Incidentally-Found Prostate Cancer Influence on Overall Survival after Radical Cystoprostatectomy,http://www.siucongress.org/eipdf/siu2012Abstract01060.pdf,Algimantas Sruogis,Marius Anglickis,Zygimantas Kardelis,Arunas Kulboka,Giedre Smailyte,Albertas Ulys,,,,,,,,,,,,,,
726,Lymph Node Positive Prostate Cancer: The Impact of Extended Pelvic Lymph Node Dissection,http://www.siucongress.org/eipdf/siu2012Abstract01061.pdf,Alexander Hinev,Deyan Anakievski,Vesselin Hadjiev,Angel Angelov,Nikolay Kolev,Anelya Klissarova,,,,,,,,,,,,,,
729,Risk Factors for Chronic Renal Impairment as Defined by eGFR after Chemotherapy for Testicular Cancer,http://www.siucongress.org/eipdf/siu2012Abstract01064.pdf,Hiromu Inai,Atsushi Ikeda,Satoshi Ando,Tomokazu Kimura,Takahiro Suetomi,Takehiro Oikawa,Jun Miyazaki,Koji Kawai,Katsunori Uchida,Hiroyuki Nishiyama,,,,,,,,,,
730,Relationship between the Stone Composition and the ESWL Results,http://www.siucongress.org/eipdf/siu2012Abstract01065.pdf,Braiek Salem,Badreddine Ben Khlifa,Zinelabidine Hosni,Gafsi Maher,Amri Nejmeddine,Mechri Maher,Elkamel Rafik,,,,,,,,,,,,,
732,Clinical Outcome of High Dose Rate Brachytherapy with External Beam Radiotherapy for Clinically Localized Prostate Cancer,http://www.siucongress.org/eipdf/siu2012Abstract01067.pdf,Takeshi Inagaki,Yasuo Kohjimoto,Hiroki Kusumoto,Kuniyoshi Ura,Satoshi Nishizawa,Kazuro Kikkawa,Yoshiki Kodama,Motohiro Koh,Nagahide Matsumura,Isao Hara,,,,,,,,,,
733,Preliminary Clinical Experience of Photodynamic Diagnosis Using 5-Aminolevulinic Acid During Radical Prostatectomy for the Detection of Positive Surgical Margins,http://www.siucongress.org/eipdf/siu2012Abstract01068.pdf,Hideo Fukuhara,Keiji Inoue,Atsushi Kurabayashi,Mutsuo Furihata,Taro Shuin,,,,,,,,,,,,,,,
734,Mechanism and Improvement of 5-Aminolevulinic Acid-Mediated Photodynamic Therapy of Prostate Cancer,http://www.siucongress.org/eipdf/siu2012Abstract01069.pdf,Hideo Fukuhara,Keiji Inoue,Taro Shuin,Atsushi Kurabayashi,Mutsuo Furihata,Hirofumi Fujita,Junzo Sasaki,Kozo Utsumi,,,,,,,,,,,,
735,The Clinical Courses of the Patients Who Chose SWL as the Initial Treatment Followed by Additional Procedures During 2007-2011 in Saitama Medical University,http://www.siucongress.org/eipdf/siu2012Abstract01070.pdf,Hanashima Fuminari,Sakamoto Hirohumi,Horinaga Minoru,Nakahira Yoko,Yanaihara Hitoshi,Asakura Hirotaka,Matsuda Kaori,,,,,,,,,,,,,
736,Efficacy and Safety of Tadalafil 5 mg Administered Once Daily in Men with Erectile Dysfunction and Lower Urinary Tract Symptoms,http://www.siucongress.org/eipdf/siu2012Abstract01071.pdf,Dalsan You,Tai Young Ahn,,,,,,,,,,,,,,,,,,
737,Extracorporeal Shockwave Lithotripsy versus Ureteroscopy for Ureteral Calculi after Obstructive Pyelonephritis,http://www.siucongress.org/eipdf/siu2012Abstract01072.pdf,Toru Kanno,Ayumu Matuda,Hiromasa Sakamoto,Yoshihito Higashi,Hitoshi Yamada,,,,,,,,,,,,,,,
738,Oncological Outcome of Radical Prostatectomy as Monotherapy for Japanese Men with High Risk Prostate Cancer,http://www.siucongress.org/eipdf/siu2012Abstract01073.pdf,Junya Furukawa,Masafumi Kumano,Kenichi Harada,Mototsugu Muramaki,Hideaki Miyake,Kazushi Tanaka,Masato Fujisawa,,,,,,,,,,,,,
739,Utility of PCA3 Urine Assay in Japanese Men Undergoing Prostate Biopsy,http://www.siucongress.org/eipdf/siu2012Abstract01074.pdf,Atsushi Ochiai,Koji Okihara,Kazumi Kamoi,Toru Shimazui,Takehiro Oikawa,Kyoichi Tomita,Shinichiro Murayama,Tohru Umekawa,Hirotsugu Uemura,Tsuneharu Miki,,,,,,,,,,
740,Risk Factors for Recurrence in Patients with Pathological T1a (pT1a) Renal Cell Carcinoma,http://www.siucongress.org/eipdf/siu2012Abstract01075.pdf,Keiichi Ito,Kenji Seguchi,Hideyuki Shimazaki,Eiji Takahashi,Shinsuke Tasaki,Kenji Kuroda,Akinori Sato,Junichi Asakuma,Akio Horiguchi,Tomohiko Asano,,,,,,,,,,
741,The Clinical Impact of Bacteremia in Acute Pyelonephritis,http://www.siucongress.org/eipdf/siu2012Abstract01076.pdf,Kiyohito Ishikawa,Masashi Nishino,Masaru Hikichi,Koshuke Fukaya,Hitoshi Ishise,Naohiko Fukami,Takahiro Maruyama,Hitomi Sasaki,Mamoru Kusaka,Ryoichi Shiroki,Kiyotaka Hoshinaga,,,,,,,,,
743,Early Response in Alkaline Phosphatase as an Independent Predictive Factor for Disease Progression in Castration-Resistant Prostate Cancer Patients with Post-chemotherapy PSA Elevation,http://www.siucongress.org/eipdf/siu2012Abstract01078.pdf,Kyung Seok Han,Kwang Hyun Kim,Sung Joon Hong,,,,,,,,,,,,,,,,,
746,"Natural History of Initially-Diagnosed Low Grade, Ta Non-muscle Invasive Bladder Tumors",http://www.siucongress.org/eipdf/siu2012Abstract01081.pdf,Eiji Kikuchi,Hiroaki Kobayashi,Shuji Mikami,Takahiro Maeda,Nobuyuki Tanaka,Akira Miyajima,Ken Nakagawa,Mototsugu Oya,,,,,,,,,,,,
747,Lateral Dominance of Positive Biopsy Cores Improves Prediction for Posterolateral Surgical Margin and Extracapsular Extension after Radical Prostatectomy,http://www.siucongress.org/eipdf/siu2012Abstract01082.pdf,Kyung Seok Han,Kwang Hyun Kim,Sung Joon Hong,,,,,,,,,,,,,,,,,
748,What Can We Do to Maximize the Detection Rates of Prostate Cancer?,http://www.siucongress.org/eipdf/siu2012Abstract01083.pdf,Go Kimura,Jun Akatsuka,Kenta Suzumura,Shunichiro Nomura,Yuka Saito,Yukihiro Kondo,,,,,,,,,,,,,,
749,Efficacy and Safety of Solifenacin in Male Patients: Results of the Non-Interventional Study 'Male Overactive Bladder on Vesicare: MOVE',http://www.siucongress.org/eipdf/siu2012Abstract01084.pdf,Christian Hampel,Max Burger,Dietmar Betz,Monika Vogel,,,,,,,,,,,,,,,,
752,Urethral Prolapse: Contemporary Report on the Ligation Over a Foley Catheter Treatment Approach,http://www.siucongress.org/eipdf/siu2012Abstract01087.pdf,Chukwudi Okorie,,,,,,,,,,,,,,,,,,,
753,Effect of Solifenacin on Cognition in Geriatric Patients: Results of the Non-Interventional Study 'Vesicare in Geriatric Application: VEGA',http://www.siucongress.org/eipdf/siu2012Abstract01088.pdf,Christian Hampel,Max Burger,Katharina Buerger,Christoph Nowak,Dietmar Betz,Monika Vogel,,,,,,,,,,,,,,
754,The Efficacy of Daily Phosphodiesterase 5 Inhibitor for Men with Erectile Dysfunction after Radical Prostatectomy,http://www.siucongress.org/eipdf/siu2012Abstract01089.pdf,Young Jun Seo,Ki Sik Shim,Jeong Moon Heo,Chang Yell Lee,,,,,,,,,,,,,,,,
756,Robot-Assisted Repair of Uterovesical Fistula,http://www.siucongress.org/eipdf/siu2012Abstract01091.pdf,Arvind Ganpule,Narendra Parikh,Shashikant Mishra,Ravindra Sabnis,Mahesh Desai,,,,,,,,,,,,,,,
759,Predictive Factors for Urinary Morbidity after I-125 Prostate Brachytherapy,http://www.siucongress.org/eipdf/siu2012Abstract01094.pdf,Tomokazu Senzaki,Tomoharu Fukumori,Masatsugu Komori,Yasuyo Yamamoto,Kunihisa Yamaguchi,Hiroyoshi Nakatsuji,Hirofumi Izaki,Masayuki Takahashi,Hiro-omi Kanayama,,,,,,,,,,,
760,Changes in Characteristics of Renal Cell Carcinoma According to the Era When it Was Identified,http://www.siucongress.org/eipdf/siu2012Abstract01095.pdf,Nozomi Hayakawa,Tsunenori Kondo,Toshio Takagi,Eri Ikezawa,Junpei Iizuka,Hirohito Kobayashi,Yasunobu Hashimoto,Kazunari Tanabe,,,,,,,,,,,,
761,Robot Assisted Pyeloplasty in Children Less than 5 Years of Age,http://www.siucongress.org/eipdf/siu2012Abstract01096.pdf,Arvind Ganpule,Amit Doshi,Shashikant Mishra,Ravindra Sabnis,Mahesh Desai,,,,,,,,,,,,,,,
762,"Prostatic Penetration of Meropenem in Humans, and Dosage Considerations for Prostatitis Based on Site-Specific Pharmacokinetic-Pharmacodynamic Evaluation",http://www.siucongress.org/eipdf/siu2012Abstract01097.pdf,Genya Nishikawa,Kazuro Ikawa,Kogenta Nakamura,Yoshiaki Yamada,Kenji Zennami,Norifumi Morikawa,Makoto Sumitomo,,,,,,,,,,,,,
763,The Efficacy and Safety of Tolterodine Tartrate in Elderly Patients with OAB: Comparison with Non-Elderly Patients,http://www.siucongress.org/eipdf/siu2012Abstract01098.pdf,Hiromi Hirama,Takuma Kato,Nobufumi Ueda,Mikio Sugimoto,Homare Okazoe,Norihito Yamamoto,Nobuyoshi Yamaoka,Isaku Nomura,Shigeo Taketa,Yoshiyuki Kakehi,,,,,,,,,,
764,MET Phosphorylation in Prostate Cancer Tissues: An Immunohistochemical Analysis,http://www.siucongress.org/eipdf/siu2012Abstract01099.pdf,Shoichiro Mukai,Satoru Sugie,Kozue Nakahara,Takayuki Goto,Chie Onizuka,Hiromasa Tukino,Toshio Kamimura,Hironobu Wakeda,Toshiyuki Kamoto,,,,,,,,,,,
765,Effect of Intrafascial Dissection Nerve-Sparing Technique on Early Recovery from Urinary Incontinence after Laparoscopic Radical Prostatectomy,http://www.siucongress.org/eipdf/siu2012Abstract01100.pdf,Akio Hoshi,Yukio Usui,Yuuki Shimizu,Tetsuro Tomonaga,Masayoshi Kawakami,Nobuyuki Nakajima,Kazuya Hanai,Takeshi Nomoto,Toshiro Terachi,,,,,,,,,,,
768,The Clinical Features of the Non-Urothelial Carcinoma of Urinary Bladder,http://www.siucongress.org/eipdf/siu2012Abstract01103.pdf,Shoji Kimura,Norishige Otsuka,Kiyokazu Umezu,Takehito Naruoka,Norihiro Hayashi,Nozomu Furuta,Shin Egawa,,,,,,,,,,,,,
769,Spices Can Affect Bladder Sensation and Muscle Contractility in Different Ways,http://www.siucongress.org/eipdf/siu2012Abstract01104.pdf,Chih-Shou Chen,Dong-Ru Ho,Wei-Yu Lin,Ching-Fang Wu,Yun-Chin Huang,Pey-Jium Chang,,,,,,,,,,,,,,
770,Robotic Partial Nephrectomy: Initial Experience,http://www.siucongress.org/eipdf/siu2012Abstract01105.pdf,Kazushi Tanaka,Junya Furukawa,Yuzo Nakano,Takeshi Ishimura,Kohei Yamaguchi,Takahiro Haraguchi,Mototsugu Muramaki,Maki Sugimoto,Hideaki Miyake,Masato Fujisawa,,,,,,,,,,
772,Transrectal HIFU for the Treatment of Localized Prostate Cancer: 13-Year Experience,http://www.siucongress.org/eipdf/siu2012Abstract01107.pdf,Toyoaki Uchida,Hakushi Kim,Sunao Shoji,Yohishiro Nagata,Toshiro Terachi,,,,,,,,,,,,,,,
774,Renal Artery Pseudoaneurysms after Partial Nephrectomy,http://www.siucongress.org/eipdf/siu2012Abstract01109.pdf,Kazuyo Ito,Tsunenori Kondo,Toshio Takagi,Eri Ikezawa,Jyunpei Iizuka,Hirohito Kobayashi,Yasunobu Hashimoto,Kazunari Tanabe,,,,,,,,,,,,
775,Clinical Significance of Preoperative Total Serum Cholesterol Level in Patients with Nonmetastatic Renal Cell Carcinoma,http://www.siucongress.org/eipdf/siu2012Abstract01110.pdf,Yoshio Ohno,Takeshi Hashimoto,Kenji Shimodaira,Ayako Tanaka,Hideki Okubo,Yohei Sawada,Issei Takizawa,Makoto Ohori,Masaaki Tachibana,,,,,,,,,,,
777,"Sequential Chemotherapy with Gemcitabine Plus Carboplatin, Followed by Additional Docetaxel for Aged Patients with Advanced Bladder Cancer",http://www.siucongress.org/eipdf/siu2012Abstract01112.pdf,Takahiro Yoneyama,Yuusuke Ishibashi,Hiromi Murasawa,Akiko Okamoto,Hayato Yamamoto,Atsushi Imai,Shingo Hatakeyama,Takuya Koie,Noritaka Kamimura,Chikara Ohyama,,,,,,,,,,
778,Prognostic Value of Lower Urinary Tract Symptom in Non-Muscle Invasive Bladder Cancer: Multicenter Study,http://www.siucongress.org/eipdf/siu2012Abstract01113.pdf,Bum Soo Kim,Phil Hyun Song,Hyun Tae Kim,Won Jae Kim,Seock Hwan Choi,Tae-Hwan Kim,Tae Gyun Kwon,Sung Kwang Chung,Bup Wan Kim,Yoon Kyu Park,,,,,,,,,,
780,Long-Term Compliance and Treatment Failure of alpha1-Blocker for Patients with Male Lower Urinary Tract Symptoms Suggestive of Benign Prostatic Hyperplasia,http://www.siucongress.org/eipdf/siu2012Abstract01115.pdf,Shin Ohira,Teruhiko Yokoyama,Masaichiro Fujita,Kazuhiko Fukumoto,Mikako Kaifu,Tomohiro Fujii,Yoshimasa Jo,Yoshiyuki Miyaji,Atsushi Nagai,,,,,,,,,,,
783,Genetic Polymorphisms in SLCO1B3 and SLCO2B1 May Influence the Racial Difference in the Response to Androgen Deprivation Therapy in Advanced Prostate Cancer,http://www.siucongress.org/eipdf/siu2012Abstract01118.pdf,Naohiro Fujimoto,Tatsuhiko Kubo,Hisato Inatomi,Bui Hoai,Takeshi Yoshida,Masaki Shiota,Tetsuro Matsumoto,,,,,,,,,,,,,
784,The Value of Post-Biopsy PSA Ratio as a Predictive Factor of High Risk Prostate Cancer,http://www.siucongress.org/eipdf/siu2012Abstract01119.pdf,Hyun Tae Kim,Bum Soo Kim,Se Yun Kwon,Jun Nyung Lee,Jae Young Choi,Seock Hwan Choi,Tae Gyun Kwon,Sung Kwang Chung,Bup Wan Kim,Yoon Kyu Park,,,,,,,,,,
785,Safety and Efficacy of Neoadjuvant Gemcitabine plus Carboplatin Followed by Immediate Cystectomy in Patients with Muscle-Invasive Bladder Cancer: A Propensity Score Analysis,http://www.siucongress.org/eipdf/siu2012Abstract01120.pdf,Takuya Koie,Akiko Okamoto,Yuki Tobisawa,Toru Yoneyama,Kazuyuki Mori,Hayato Yamamoto,Shingo Hatakeyama,Takahiro Yoneyama,Yasuhiro Hashimoto,Chikara Ohyama,,,,,,,,,,
786,Is Pelvic Lymph Node Dissection Needed for Low-Risk Prostate Cancer at Radical Prostatectomy?,http://www.siucongress.org/eipdf/siu2012Abstract01121.pdf,Koji Mitsuzuka,Yasuhiro Kaiho,Shintaro Narita,Takuya Koie,Sadafumi Kawamura,Tatsuo Tochigi,Tomonori Habuchi,Chikara Ohyama,Yoichi Arai,,,,,,,,,,,
787,Fracture of the Penis: A Study of 9 Cases,http://www.siucongress.org/eipdf/siu2012Abstract01122.pdf,Ajit Vaze,,,,,,,,,,,,,,,,,,,
788,Efficacy of a Single Session Ureteroscopy with Holmium Laser Lithotripsy for Multiple Stones,http://www.siucongress.org/eipdf/siu2012Abstract01123.pdf,Ryoji Takazawa,Sachi Kitayama,Toshihiko Tsujii,,,,,,,,,,,,,,,,,
789,Lidocaine Bladder Instillation for Prevention of Autonomic Dysreflexia during Suprapubic Cystostomy Placement for Upper Spinal Cord Lesion,http://www.siucongress.org/eipdf/siu2012Abstract01124.pdf,Hideo Ozawa,Miyabi Inoue,Shinjirou Shimizu,You Tokunaga,Hiroshi Yakushiji,Yoshitsugu Nasu,,,,,,,,,,,,,,
790,Application of Computer Optimization Method of Minimally Invasive Surgical Access Based on Pre-Surgical Tomography Data,http://www.siucongress.org/eipdf/siu2012Abstract01125.pdf,Vasilii Dubrovin,Valerii Bashirov,Alexey Tabakov,Alexender Egoshin,,,,,,,,,,,,,,,,
792,Health Information Quality on the Internet in Benign Prostatic Hyperplasia and its Treatment: A Multilingual Evaluation,http://www.siucongress.org/eipdf/siu2012Abstract01127.pdf,Rustom P. Manecksha,Emily Chen,Robert Abouassaly,Nathan Lawrentschuk,,,,,,,,,,,,,,,,
793,"Positive Associations of Current and Past History of Kidney Stones with Overweight, Hypertension, Hyperuricemia and Chronic Kidney Disease in a Screened Population",http://www.siucongress.org/eipdf/siu2012Abstract01128.pdf,Ryosuke Ando,Teruo Nagaya,Sadao Suzuki,Atsushi Okada,Takahiro Yasui,Keiichi Tozawa,Hidekatsu Takahashi,Makoto Kawai,Kenjiro Kohri,,,,,,,,,,,
794,A Novel Diagnostic Technique for Venoocclusive Erectile Dysfunction,http://www.siucongress.org/eipdf/siu2012Abstract01129.pdf,Oleg Apolikhin,Evgeny Efremov,Oleg Zhukov,Sergei Scherbinin,Yaroslav Melnik,Stepan Krasnyak,Azamat Ulbashev,Valeriy Simakov,,,,,,,,,,,,
795,Identification of Prognostic Predictors in Japanese Men with Metastatic Castration-Resistant Prostate Cancer Who Were Treated with Docetaxel-Based Chemotherapy,http://www.siucongress.org/eipdf/siu2012Abstract01130.pdf,Akira Miyazaki,Hideaki Miyake,Taka-aki Inoue,Masato Fujisawa,,,,,,,,,,,,,,,,
796,Initial Experience with Robot-Assisted Laparoscopic Radical Cystectomy with Extracorporeal Urinary Diversion,http://www.siucongress.org/eipdf/siu2012Abstract01131.pdf,Keisuke Hieda,Masaki Shibata,Kenichiro Ikeda,Shunsuke Shinmei,Koichi Shoji,Katutoshi Miyamoto,Hiroshi Masumoto,Shogo Inoue,Kanao Kobayashi,Tetsutaro Hayashi,Mitsuru Kajiwara,Jun Teishima,Akio Matsubara,,,,,,,
797,Evaluation of Sleep Quantity and Quality in Older Adults with Nocturia Using Portable Electroencephalogram Acquisition Device,http://www.siucongress.org/eipdf/siu2012Abstract01132.pdf,Chie Matsushita,Akihide Hirayama,Kazumasa Torimoto,Yoshihiro Matsumoto,Atsushi Yamada,Kiyohide Fujimoto,Yoshihiko Hirao,,,,,,,,,,,,,
798,Safety and Efficacy of Sorafenib in Japanese Patients with Renal Cell Carcinoma under Daily Medical Practice: Result from the Post-Marketing All-Patient Surveillance with >3200 Cases,http://www.siucongress.org/eipdf/siu2012Abstract01133.pdf,Masatoshi Adachi,Yutaka Okayama,Tadamichi Kubo,Hideyuki Akaza,Satoshi Yamanaka,,,,,,,,,,,,,,,
800,Initial Operative Experience: Single-Port Retroperitoneal Laparoendoscopic Urological Surgery,http://www.siucongress.org/eipdf/siu2012Abstract01135.pdf,Takatsugu Okegawa,Naoshi Itaya,Hidehiko Hara,Toshihide Shishido,Kikuo Nutahara,Eiji Higashihara,,,,,,,,,,,,,,
802,A Case of Lymph Node Metastasis from Collecting Duct Carcinoma Which Responded to Sunitinib,http://www.siucongress.org/eipdf/siu2012Abstract01137.pdf,Kiyoshi Setoguchi,Shogo Mizoguchi,Nozomi Hayakawa,Yasuyuki Sato,Tadahiko Tokumoto,Hiroshi Toma,,,,,,,,,,,,,,
