paper_no,Name,URL,Author1,Author2,Author3,Author4,Author5,Author6,Author7,Author8,Author9,Author10,Author11,Author12,Author13,Author14,Author15,Author16,Author17,Author18,Author19,Author20
6,In Vitro Effects of Different Settings of Calculase II Upon Different Stone Classes,http://www.siucongress.org/eipdf/siu2012Abstract00211.pdf,Gauthier Raynal,Thibaut Saussez,Saeed Al-Qahtani,Nicolas Henry,Jean-Philippe Haymann,Mohamed Tligui,Michel Daudon,Olivier Traxer,,,,,,,,,,,,
7,Urinary Schistosomiasis: A Western Cohort,http://www.siucongress.org/eipdf/siu2012Abstract00212.pdf,Gauthier Raynal,Mohamed Tligui,Guillaume Le Loup,Nicolas Henry,,,,,,,,,,,,,,,,
8,In-Hospital Stays for Urolithiasis: Analysis of French National Data,http://www.siucongress.org/eipdf/siu2012Abstract00213.pdf,Gauthier Raynal,Mohamed Tligui,Olivier Traxer,,,,,,,,,,,,,,,,,
9,MRI-Navigated Stereotactic Prostate Biopsy,http://www.siucongress.org/eipdf/siu2012Abstract00214.pdf,Boris Hadaschik,Timur Kuru,Matthias Roethke,Dogu Teber,Sascha Pahernik,Heinz-Peter Schlemmer,Markus Hohenfellner,,,,,,,,,,,,,
10,Phantom Study of a Novel Stereotactic Prostate Biopsy System Integrating Preinterventional MRI and Live US Fusion,http://www.siucongress.org/eipdf/siu2012Abstract00215.pdf,Boris Hadaschik,Timur Kuru,Matthias Roethke,Sascha Pahernik,Heinz-Peter Schlemmer,Markus Hohenfellner,,,,,,,,,,,,,,
19,Sclerotherapy: Clinical Results with 98% Alcohol in 30 Cases of Symptomatic Renal Cysts,http://www.siucongress.org/eipdf/siu2012Abstract00224.pdf,Naser Alfgi,Tahier Alsheridy,Othman Bashier,Abdulghany Hussien,Ali Alshafie,,,,,,,,,,,,,,,
26,A Call for Updating the Suprapubic Catheter SPC Insertion Guidelines,http://www.siucongress.org/eipdf/siu2012Abstract00231.pdf,Rozh Jalil,Joy Roach,Chandrika Mukundan,Tahir Bhatti,,,,,,,,,,,,,,,,
27,Large Kidney Graft Renal Artery Aneurysm: Excision and Vascular Reconstruction with Arterial Allograft,http://www.siucongress.org/eipdf/siu2012Abstract00232.pdf,Frederico Furriel,Arnaldo Figueiredo,Pedro Eufrásio,Lorenzo Marconi,Silvio Bollini,Ana Brett,Alfredo Mota,,,,,,,,,,,,,
28,Urologic Disease in a Resource Poor Country,http://www.siucongress.org/eipdf/siu2012Abstract00233.pdf,Marc Manganiello,Christopher Hughes,David Bayne,Jill Buckley,John Meara,Lars Hagander,,,,,,,,,,,,,,
32,Villa Tiberia Experience in the Treatment of Renal Stones with Retrograde Intrarenal Surgery (RIRS),http://www.siucongress.org/eipdf/siu2012Abstract00238.pdf,Roberto Giulianelli,Barbara Cristina Gentile,Francesco Pisanti,Luca Mavilla,Francesco Attisani,Luca Albanesi,Gabriella Mirabile,Teuta Shestani,Manlio Schettini,,,,,,,,,,,
33,Treatment of Uretero-Pelvic Stones: Laser Ureteroscopic Lithotripsy and ESWL,http://www.siucongress.org/eipdf/siu2012Abstract00239.pdf,Roberto Giulianelli,Barbara Cristina Gentile,Francesco Pisanti,Francesco Attisani,Luca Albanesi,Luca Mavilla,Gabriella Mirabile,Teuta Shestani,Manlio Schettini,,,,,,,,,,,
36,Morphological and Histochemical Analysis of the Ileal Orthotopic Neobladder Mucosa Transformation,http://www.siucongress.org/eipdf/siu2012Abstract00242.pdf,Oleksandr Iatsyna,Eduard Stakhovsky,Oleg Voilenko,Yuriy Vitruk,Oleksandr Stakhovsky,Sergey Vernygorodskyi,Alla Yemets,,,,,,,,,,,,,
38,Assessing the Influence of Benign Prostatic Hyperplasia (BPH) on Erectile Dysfunction (ED) Among Patients in Poland,http://www.siucongress.org/eipdf/siu2012Abstract00244.pdf,Slawomir Dutkiewicz,Dariusz Skawinski,Wieslaw Duda,Magdalena Duda,,,,,,,,,,,,,,,,
39,Prevalence of Multiple Types of Genital Human Papillomavirus Infections in Men: A Study in Poland,http://www.siucongress.org/eipdf/siu2012Abstract00245.pdf,Leszek Walczak,Slawomir Dutkiewicz,Slawomir Majewski,Stefania Jablonska,,,,,,,,,,,,,,,,
42,"Prediction of Androgen Deprivation Therapy Response Using Laser Captured Microdisection Technique in Patients with Metastatic Prostate Cancer
",http://www.siucongress.org/eipdf/siu2012Abstract00252.pdf,Tetsuya Fujimura,Satoru Takahashi,Tomohiko Urano,Haruki Kume,Kenich Takayama,Taro Murata,Yuta Yamada,Daisuke Obinata,Satoshi Inoue,Yukio Homma,,,,,,,,,,
44,French National Trends in Prostatic Surgery Volume,http://www.siucongress.org/eipdf/siu2012Abstract00254.pdf,Eric Alezra,Thomas François,Fabien Saint,Jean-Claude Kikassa,Gauthier Raynal,,,,,,,,,,,,,,,
45,Functional Evaluation of Artificial Ileal Bladder by 'Double U' Method within Separate Postoperative Period,http://www.siucongress.org/eipdf/siu2012Abstract00266.pdf,Oleksandr Iatsyna,Oleg Voilenko,Oksana Gavriluk,Yurii Vitruk,Yurii Chernienko,Alla Yemets,Eduard Stakhovsky,,,,,,,,,,,,,
46,Percutaneous Nephrolithotomy: Critical Analysis of Unfavorable Results,http://www.siucongress.org/eipdf/siu2012Abstract00267.pdf,Abdulqadir Alobaidy,Abdullah Al-Naimi,Khalid Assadiq,Haider Alkhafaji,Abdulla Al-Ansari,Ahmed Shokeir,,,,,,,,,,,,,,
48,Prospective Randomized Trial of Povidone-iodine Prophylactic Cleansing of the Rectum Prior to Transrectal Ultrasound-Guided Prostate Biopsy,http://www.siucongress.org/eipdf/siu2012Abstract00269.pdf,Zeid Abughosh,Joseph Margolick,S. Larry Goldenberg,Stephen Taylor,Martin E. Gleave,Ben Chew,William Bowie,Diane Roscoe,Lindsay Machan,Peter Black,,,,,,,,,,
50,BackStop Gel to Prevent Stone Fragment Migration after Endourologic Lithotripsy: Initial Experience,http://www.siucongress.org/eipdf/siu2012Abstract00271.pdf,Alejandro Rodriguez,Michelle Pacheco,Tariq Hakky,,,,,,,,,,,,,,,,,
51,Robotic-Assisted Ileovesicostomy: A Pure Intracorporeal Technique Video,http://www.siucongress.org/eipdf/siu2012Abstract00272.pdf,Alejandro Rodriguez,Philippe Spiess,Tariq Hakky,,,,,,,,,,,,,,,,,
55,Is Routine Computed Tomography of Upper Urinary Tract Justified Following Bladder Cancer Surgery in the Era of Powerful Ultrasonography?,http://www.siucongress.org/eipdf/siu2012Abstract00278.pdf,Cedomir Topuzovic,Pejcic Toma,Tulic Cane,,,,,,,,,,,,,,,,,
60,Non-functioning Kidneys: Is Nephrectomy Indicated? A 10-Year Review,http://www.siucongress.org/eipdf/siu2012Abstract00283.pdf,Chang Chung Ngo,Cheong Yu,Sau Kwan Chu,Chi Wai Man,,,,,,,,,,,,,,,,
61,Our Experience in Penile Fracture Management,http://www.siucongress.org/eipdf/siu2012Abstract00284.pdf,Isa Haxhiu,Xhevdet Cuni,Sabri Hyseni,Hilmije Aliu,Anduena Haxhiu,Emirjon Haxhiu,,,,,,,,,,,,,,
64,Investigation of Time Period-Related Differences in Prophylactic Effects of BCG Intravesical Instillation Therapy,http://www.siucongress.org/eipdf/siu2012Abstract00354.pdf,Takehiko Okamura,Ryosuke Ando,Hidetoshi Akita,Akihiro Nakane,Takahiro Kobayashi,Yoshihiro Hashimoto,Yutaka Iwase,Noriyasu Kawai,Keiichi Tozawa,Kenjiro Kohri,,,,,,,,,,
65,Plasma Thymosin-alpha1 Level as a Potential Biomarker in Urothelial and Renal Cell Carcinoma,http://www.siucongress.org/eipdf/siu2012Abstract00355.pdf,Yeong-Chin Jou,Yuh-Shyan Tsai,Chang-Huang Shen,Chang-Te Lin,,,,,,,,,,,,,,,,
66,Investigation of Gene Transfer Using the Human JC Virus-like Particle to Inhibit Human Urothelial Carcinoma Cell Growth,http://www.siucongress.org/eipdf/siu2012Abstract00356.pdf,Cheng-Huang Shen,Yeong-Chin Jou,Chang-Te Lin,Pi-Che Chen,Deching Chang,,,,,,,,,,,,,,,
70,Functional and Morphological Properties of Pericytes in Bladder Suburothelial Venules: Pacemaker Cells of Suburothelial Microcirculation,http://www.siucongress.org/eipdf/siu2012Abstract00360.pdf,Hikaru Hashitani,Retsu Mitsui,Yuki Shimizu,Keisuke Ohta,Keiichiro Nakamura,,,,,,,,,,,,,,,
72,Clinicopathological Characterization of the Micropapillary Variant of Bladder Cancer,http://www.siucongress.org/eipdf/siu2012Abstract00362.pdf,Hiroshi Kitamura,Toshihiko Torigoe,Yoshihiko Hirohashi,Hiroko Asanuma,Sachiyo Nishida,Ryuta Inoue,Toshiaki Tanaka,Naoya Masumori,Noriyuki Sato,Taiji Tsukamoto,,,,,,,,,,
75,Upper Urinary Tract Calculus Is the Highest Risk for Nephrectomy for Non-Renal Tumor Patients: A Single Center Study Over 10 Years,http://www.siucongress.org/eipdf/siu2012Abstract00371.pdf,Shanhua Mao,Haowen Jiang,Zhong Wu,Zujun Fang,Guowei Xia,Qiang Ding,,,,,,,,,,,,,,
79,Inadequate Testosterone Suppression in Prostate Cancer Patients Failing on GnRH Agonists: Preliminary Data from the Delay Study,http://www.siucongress.org/eipdf/siu2012Abstract00378.pdf,Alan Abramovitch,Cal Andreou,Jack Barkin,Richard Casey,Stanley Flax,John Giddens,Eric Hirshberg,Kenneth Jansz,Lorne Aaron,Thomas Kinahan,Morrie Liquornik,Alvaro Morales,Jean Simard,Gary Steinhoff,George Vrabec,Robert Siemens,Pierre Karakiewicz,Joseph Zadra,Wilson Leung,Todd Webster
80,Identification of Novel Micrornas Associated with Epithelial-Mesenchymal Transition in Human Bladder Cancer by miRNA Chip Array Profiling,http://www.siucongress.org/eipdf/siu2012Abstract00379.pdf,Masakazu Nakashima,Yoshiyuki Matsui,Ryoichi Saito,Fumiaki Sato,Hiroyuki Nishiyama,Osamu Ogawa,,,,,,,,,,,,,,
82,Incidence and Prognostic Implications of Perineural Invasion with Urothelial Carcinoma Following Radical Cystectomy,http://www.siucongress.org/eipdf/siu2012Abstract00390.pdf,Robert Flanigan,Manoj Rao,Ted Vellos,Guliz Barkan,Marcus Quek,,,,,,,,,,,,,,,
83,Lingual Mucosa Harvest Technique,http://www.siucongress.org/eipdf/siu2012Abstract00391.pdf,Ramon Virasoro,Gabriel Catalan,Reynaldo Gomez,Kurt McCammon,,,,,,,,,,,,,,,,
84,Changing Patterns of Antibiotic Sensitivities in Urinary Tract Infections,http://www.siucongress.org/eipdf/siu2012Abstract00392.pdf,Sunny Doodu Mante,,,,,,,,,,,,,,,,,,,
85,Body Weight Status as Predicted by Body Mass Index and Dual-Energy X-Ray Absorpitometry Scanning Predicts Pre-Treatment Risk of PSA Failure in Men with Clinically Localized Prostate Cancer,http://www.siucongress.org/eipdf/siu2012Abstract00393.pdf,Robert Flanigan,Vincent Freeman,Courtney Hollowell,Jeffrey Branch,Leslie Deane,Marcus Quek,Patricia Vidal,Michael Woods,Firas Dabbous,Daisy Citron,,,,,,,,,,
87,Hereditary Urothelial Carcinomas of the Upper Urinary Tract Are Underestimated and Misclassified as Sporadic Tumours: Results of the French Collaborative Database on UUT-UCC,http://www.siucongress.org/eipdf/siu2012Abstract00395.pdf,Morgan Roupret,François Audenet,Véronique Phé,David Yates,Adil Ouzzane,Laurent Guy,Stephane Droupy,Pierre Colin,Emmanuel Chartier-Kastler,,,,,,,,,,,
88,Cancer-Specific Survival After Nephroureterectomy for Upper Urinary Tract Urothelial Carcinoma: External Validation of a Predictive Nomogram Using a French Collaborative National Database,http://www.siucongress.org/eipdf/siu2012Abstract00396.pdf,Morgan Roupret,Vincent Hupertan,David Yates,Adil Ouzzane,Geraldine Pignot,Véronique Phé,Laurent Guy,Gilles Karsenty,Franck Bruyère,Pierre Colin,Emmanuel Chartier-Kastler,,,,,,,,,
89,Early Experience in Laparoscopic Urology in Nepal,http://www.siucongress.org/eipdf/siu2012Abstract00397.pdf,Robin Joshi,,,,,,,,,,,,,,,,,,,
90,Does Private Health Insurance Status Affect the Pathological Outcomes in Patients Undergoing Radical Prostatectomy in the United Kingdom?,http://www.siucongress.org/eipdf/siu2012Abstract00398.pdf,Simon Robinson,Amrith Rao,Hanif Motiwala,Marc Laniado,Jas Kalsi,Omer Karim,,,,,,,,,,,,,,
92,"Diagnostic Significance of Prostate-Specific Antigen, Density Accuracy and PSAD Adjusted by Transition Zone Volume in Men with PSA Levels Between 2.0 and 4.0 ng/ml",http://www.siucongress.org/eipdf/siu2012Abstract00401.pdf,Mohamed Abbar,Abdellatif Janane,Taher Ould Ismail,Mohamed Ghadouane,Ahmed Ameur,,,,,,,,,,,,,,,
93,Free/Total PSA Ratio: Predictive Value in Auguring Prostate Cancer Occurrence in African Men with Initial PSA Levels of 2.0 to 4.0 ng/ml,http://www.siucongress.org/eipdf/siu2012Abstract00402.pdf,Mohamed Abbar,Abdellatif Janane,Taher Ould Ismail,Mohamed Ghadouane,Ahmed Ameur,,,,,,,,,,,,,,,
94,Hyperbaric Oxygen Therapy (HBOT) Concomittent to Surgery for Fournier's Gangrene,http://www.siucongress.org/eipdf/siu2012Abstract00403.pdf,Mohamed Abbar,Abdellatif Janane,Taher Ould Ismail,Mohamed Ghadouane,Ahmed Ameur,,,,,,,,,,,,,,,
95,Prognostic Value of HER2 Protein Expression in PT1 GII-PT1 GIII Bladder Transitional Cell Carcinoma,http://www.siucongress.org/eipdf/siu2012Abstract00404.pdf,Abdellatif Janane,Taher Ould Ismail,Mohamed Ghadouane,Ahmed Ameur,Mohamed Abbar,,,,,,,,,,,,,,,
96,Total Body Bone Mineral Density and Regional Bone Mineral Density in Patients with Prostate Cancer,http://www.siucongress.org/eipdf/siu2012Abstract00405.pdf,Abdellatif Janane,Taher Ould Ismail,Mohamed Ghadouane,Ahmed Ameur,Mohamed Abbar,,,,,,,,,,,,,,,
97,Value of the Spot Urine Sample for the Metabolic Evaluation of Urolithiasis Patients,http://www.siucongress.org/eipdf/siu2012Abstract00406.pdf,Ahmed El Nashar,Adel Hussein,Ezzat Abu Almajd,Ammar Ghobish,,,,,,,,,,,,,,,,
101,Dynamic Transperineal Ultrasound in the Diagnosis of Female Lower Urinary Symptoms: Our Experience,http://www.siucongress.org/eipdf/siu2012Abstract00411.pdf,Gabriella Mirabile,Barbara Cristina Gentile,Francesco Pisanti,Luca Albanesi,Luca Mavilla,Stefano Brunori,Teuta Shestani,Giorgio Vincenti,Francesco Attisani,Roberto Giulianelli,,,,,,,,,,
103,Female Urethral Diverticula: 10 Years' Experience,http://www.siucongress.org/eipdf/siu2012Abstract00413.pdf,Manlio Schettini,Gabriella Mirabile,Barbara Cristina Gentile,Luca Mavillla,Luca Albanesi,Stefano Brunori,Francesco Attisani,Franesco Pisanti,Giorgio Vincenti,Roberto Giulianelli,,,,,,,,,,
106,Laser Therapy for Stricture of the Ureter,http://www.siucongress.org/eipdf/siu2012Abstract00416.pdf,Ekaterina Kulchavenya,,,,,,,,,,,,,,,,,,,
108,Artificial Urinary Sphincter AMS 800 after Urethroplasty,http://www.siucongress.org/eipdf/siu2012Abstract00418.pdf,Khalid Sayedahmed,Thomas Jachertz,Björn Theodor Kaftan,Jens Riepehusen,Roberto Olianas,,,,,,,,,,,,,,,
109,Urethroplasty after Radiotherapy: A Single-Institutional Experience,http://www.siucongress.org/eipdf/siu2012Abstract00419.pdf,Khalid Sayedahmed,Björn Theodor Kaftan,Thomas Jachertz,Roberto Olianas,,,,,,,,,,,,,,,,
113,"Is Documentation of Urethral Catheterisation Important? An Experience in a District General Hospital, UK",http://www.siucongress.org/eipdf/siu2012Abstract00424.pdf,Waseem Akhter,Tabassum Shaheen,Abid Khattak,Saifal Khan Turk,Frank Chinegwundoh,,,,,,,,,,,,,,,
120,"RNAi-mediated Silencing of Nemo-like Kinase Inhibits Cell Proliferation in Human Bladder Carcinoma Cells

",http://www.siucongress.org/eipdf/siu2012Abstract00431.pdf,Tao Liu,Chuize kong,,,,,,,,,,,,,,,,,,
124,Contemporary Occupational Bladder Cancer: A Systematic Review and Meta-Analysis of Recently Reported Exposures that Increase Risk,http://www.siucongress.org/eipdf/siu2012Abstract00435.pdf,Marcus Cumberbatch,Angela Cox,James Catto,Simon Pickvance,,,,,,,,,,,,,,,,
125,"Caffeic Acid Phenethyl Ester Augments Docetaxel-Cytotoxicity in PC-3 Cells by Inducing Apoptosis Through Modulation of Estrogen Receptors

",http://www.siucongress.org/eipdf/siu2012Abstract00436.pdf,Mai Tolba,Hisham Mosli,Ahmed Al-Abd,Samar Azab,Amani Khalifa,Ashraf Abdel-Naim,,,,,,,,,,,,,,
127,"Orthotopic Sigmoid Versus Ileal Neobladders in Japanese Patients: A Comparative Assessment of Complications, Functional Outcomes and Quality of Life",http://www.siucongress.org/eipdf/siu2012Abstract00438.pdf,Hideaki Miyake,Junya Furukawa,Mototsugu Muramaki,Masato Fujisawa,,,,,,,,,,,,,,,,
128,Prognostic Significance of Tumor Extension Into Venous System in Patients Undergoing Surgical Treatment for Renal Cell Carcinoma with Venous Tumor Thrombus,http://www.siucongress.org/eipdf/siu2012Abstract00439.pdf,Hideaki Miyake,Junya Furukawa,Mototsugu Muramaki,Masato Fujisawa,,,,,,,,,,,,,,,,
129,Outcome of Laparoscopic Upper Heminephrectomy in Children: Two Centers Experience,http://www.siucongress.org/eipdf/siu2012Abstract00440.pdf,Ali Gözen,Dogu Teber,Haytham Badawy,Akram Assem,Jens Rassweiler,,,,,,,,,,,,,,,
131,Tolerability and Efficacy of Newly Developed Penile Injection of Cross-Linked Dextran and Polymethylmethacrylate Mixture on Penile Enhancement: One-Year Follow-up,http://www.siucongress.org/eipdf/siu2012Abstract00442.pdf,Dae Yul Yang,Won Ki Lee,Tae Hyung Kim,Sae-chul Kim,Sung Yong Kim,,,,,,,,,,,,,,,
138,"Laparoscopic Management of Benign Urological Diseases: Experience of 105 Cases
",http://www.siucongress.org/eipdf/siu2012Abstract00450.pdf,N I Bhuiyan,M F Islam,S.A. Kahn,Z H Bhuiyan,K M H Tawhid,N.I.U. Ahmed,K Salahuddin,M.A. Arafat,A.B. Siddique,T.U. Islam,,,,,,,,,,
139,"Laparoscopic Management of Malignant Urological Diseases: Experience of 35 Cases
",http://www.siucongress.org/eipdf/siu2012Abstract00451.pdf,NI Bhuiyan,M F Islam,S.A. Khan,Z H Bhuiyan,K M H Tawhid,N.I.U. Ahmed,K Salahuddin,M.A. Arafat,A.B. Siddique,T.U. Islam,,,,,,,,,,
140,"Bilateral Tubeless and JJ Stentless PCNL: Experience of 17 Cases

",http://www.siucongress.org/eipdf/siu2012Abstract00452.pdf,NI Bhuiyan,M F Islam,Z H Bhuiyan,K M H Tawhid,NIU Ahmed,K Salahuddin,M.A. Arafat,,,,,,,,,,,,,
141,Use of Only Ureteric Catheter 24 to 48 Hours Postoperatively Reduces Nephrostomy Tube and JJ Stent Related Morbidity in Selected Cases of Percutaneous Nephrolithotomy,http://www.siucongress.org/eipdf/siu2012Abstract00453.pdf,NI Bhuiyan,M F Islam,Z H Bhuiyan,K M H Tawhid,NIU Ahmed,K Salahuddin,M.A. Arafat,,,,,,,,,,,,,
142,"Percutaneous Nephrolithotomy in Paediatric Age Group: Single Centre Experience
",http://www.siucongress.org/eipdf/siu2012Abstract00454.pdf,NI Bhuiyan,K M H Tawhid,M F Islam,Z H Bhuiyan,NIU Ahmed,K Salahuddin,M.A. Arafat,,,,,,,,,,,,,
151,Alpha1D-Adrenergic Antagonists Inhibits TRPM8 Receptor Related Cold Stress-induced Detrusor Overactivity in Ovariectomized Rats,http://www.siucongress.org/eipdf/siu2012Abstract00471.pdf,Wataru Noguchi,Tetsuya Imamura,Osamu Ishizuka,Yoshiki Kurizaki,Lei Zhong,Silwal Gautam Sudha,Takahiro Yamagishi,Hitoshi Yokoyama,Osamu Nishizawa,,,,,,,,,,,
152,Subcutaneous Prosthetic Ureter in Kidney Transplant Patients,http://www.siucongress.org/eipdf/siu2012Abstract00472.pdf,Mohammad Yazdani Kachouei,Mohammad Reza Gharaati,Mahtab Zargham,Kia Nouri-Mahdavi,Emadeddin Yazdani Kachouei,,,,,,,,,,,,,,,
153,Endourological Procedures for the Management of Urinary Calculi in Transplanted Kidneys,http://www.siucongress.org/eipdf/siu2012Abstract00473.pdf,Reza Mahdavi,Mahmoud Tavakoli,Rahim Taghavi,Iraj Eftekhar Shahroudi,Farid Aghasizadeh,Alireza Ghoreifi,,,,,,,,,,,,,,
154,Transplantation of Cadaveric Pediatric Kidneys into Adult Recipients,http://www.siucongress.org/eipdf/siu2012Abstract00474.pdf,Reza Mahdavi,Behnam Shakiba,Mahmoud Tavakoli,Kazem Heidari,,,,,,,,,,,,,,,,
155,Successful Transplantation of a Split Crossed Fused Lump Type Ectopic Kidney into Two Patients with ESRD,http://www.siucongress.org/eipdf/siu2012Abstract00475.pdf,Reza Mahdavi,Naser Mogharabian,Alireza Ghoreifi,Behnam Shakiba,,,,,,,,,,,,,,,,
156,A Cross-Sectional Survey of Nocturia in Japan Using the N-QOL,http://www.siucongress.org/eipdf/siu2012Abstract00476.pdf,Tomonori Yamanishi,Shinsuke Kurokawa,Tatsuo Morita,Takao Kamai,,,,,,,,,,,,,,,,
158,Type of Androgen Deprivation Therapy Affects Metabolic Condition and Adipose Tissue Distribution,http://www.siucongress.org/eipdf/siu2012Abstract00480.pdf,Shingo Hatakeyama,Hayato Yamamoto,Hiromi Murasawa,Akiko Okamoto,Atsushi Imai,Takahiro Yoneyama,Yasuhiro Hashimoto,Takuya Koie,Noritaka Kamimura,Chikara Ohyama,,,,,,,,,,
161,New Approach to Robotic Simple Prostatectomy,http://www.siucongress.org/eipdf/siu2012Abstract00483.pdf,Rene Sotelo,Octavio Almanzor,Robert De Andrade,Oswaldo Carmona,Rafael Clavijo,Mihir Desai,Monish Aron,Alvin Goh,Inderbill Gill,,,,,,,,,,,
162,Robotic Repair of Vesicovaginal Fistulae: Transperitoneal Transvaginal Approach,http://www.siucongress.org/eipdf/siu2012Abstract00484.pdf,Rene Sotelo,Rafael Clavijo,Robert De Andrade,Oswaldo Carmona,Octavio Almanzor,Roberto Garza,Mario Urdininea,,,,,,,,,,,,,
170,Association Between History of Acute Urinary Retention and Post-Transurethral Resection of Prostate Complications: A Population-Based Study,http://www.siucongress.org/eipdf/siu2012Abstract00492.pdf,Jeng-Sheng Chen,Wen-Horng Yang,Yea-Huei Kao,Chia-Hsien Chang,,,,,,,,,,,,,,,,
172,"Comparison of 90-Day Readmission Rates Between Retropubic, Laparoscopic, and Robotic-Assisted Radical Prostatectomy",http://www.siucongress.org/eipdf/siu2012Abstract00494.pdf,Po-Wen Ku,Shiu-Dong Chung,Joseph J. Keller,Herng-Ching Lin,Chao-Yuan Huang,Yi-Hua Chen,,,,,,,,,,,,,,
174,"Prevalence of Overactive Bladder Symptoms, Stress Incontinence and Associated Bother in Women Aged 40 and Above: A Belgian Epidemiological Survey",http://www.siucongress.org/eipdf/siu2012Abstract00496.pdf,Dirk De Ridder,Thierry Roumeguère,Jean Smets,,,,,,,,,,,,,,,,,
175,"The Effects of Pilocarpine, a Muscarinic Receptor Agonist, on Contraction of the Urinary Bladder in the Pig and Human",http://www.siucongress.org/eipdf/siu2012Abstract00497.pdf,Tomonori Yamanishi,Miki Fuse,Takao Kamai,Tomoyuki Uchiyama,,,,,,,,,,,,,,,,
176,Intravesical OnabotulinumtoxinA Injections for Refractory Painful Bladder Syndrome,http://www.siucongress.org/eipdf/siu2012Abstract00498.pdf,Po-Wen Ku,Shiu-Dong Chung,Hann-Chorng Kuo,Yuh-Chen Kuo,,,,,,,,,,,,,,,,
177,A Key Role for ARF in Drug Resistance in Invasive Bladder Cancer,http://www.siucongress.org/eipdf/siu2012Abstract00499.pdf,Takashi Kobayashi,Osamu Ogawa,Cory Abate-Shen,,,,,,,,,,,,,,,,,
178,A Nationwide Population-Based Study on the Association between Chronic Periodontitis and Erectile Dysfunction,http://www.siucongress.org/eipdf/siu2012Abstract00500.pdf,Jiun-Siang Tan,Shiu-Dong Chung,Joseph Keller,Herng-Ching Lin,,,,,,,,,,,,,,,,
179,Retroperitoneal Laparoscopic Surgery in the Urologic Practice,http://www.siucongress.org/eipdf/siu2012Abstract00501.pdf,Suniyat Kussymzhanov,Myrza Alchinbayev,,,,,,,,,,,,,,,,,,
183,Alterations in Peripheral Purinergic and Muscarinic Signaling of Rat Bladder After Long-Term Fructose-Induced Metabolic Syndrome,http://www.siucongress.org/eipdf/siu2012Abstract00505.pdf,Jiun-Siang Tan,Shiu-Dong Chung,Chiang-Ting Chien,Hong-Jeng Yu,,,,,,,,,,,,,,,,
184,The Value of 18F-FDG PET-CT for the Evaluation of Treatment Success of Cryosurgery for Small Renal Mass; A Pilot Study,http://www.siucongress.org/eipdf/siu2012Abstract00506.pdf,Brunolf Lagerveld,Rutger Sandkuyl,Ferida Sivro,Han van der Zee,Phillip Baars,,,,,,,,,,,,,,,
185,Comparing the Distribution of Anatomical Complexity of Small Renal Masses Treated With Laparoscopic Cryoablation: PADUA Versus R.E.N.A.L. Nephrometry Score,http://www.siucongress.org/eipdf/siu2012Abstract00507.pdf,Brunolf Lagerveld,Marleen van Dijk,Han van der Zee,,,,,,,,,,,,,,,,,
188,A Unique Case of Male Genital Anomaly Complex and Its Surgical Reconstruction,http://www.siucongress.org/eipdf/siu2012Abstract00510.pdf,Essam Marzouk,,,,,,,,,,,,,,,,,,,
189,Location of Positive Margins in Radical Prostatectomy Specimens: Prognostic Implications,http://www.siucongress.org/eipdf/siu2012Abstract00511.pdf,M. Andreas Roder,Marie-Louise Vrang,Ib Jarle Christen,Lisa Gruschy,Klaus Brasso,Ben Vainer,Peter Iversen,,,,,,,,,,,,,
191,Do Urethrograms Post-Urethroplasty Predict Outcome and Aid Timing of Catheter Removal?,http://www.siucongress.org/eipdf/siu2012Abstract00513.pdf,Jonathan Noel,Andrew Winterbottom,Andrew Doble,Nikesh Thiruchelvam,,,,,,,,,,,,,,,,
194,Laparoscopic Versus Open Radical Cystectomy: A Comparison of Quality of Life Outcomes,http://www.siucongress.org/eipdf/siu2012Abstract00516.pdf,Syed Shahzad,Alan P Doherty,John Parkin,Rupesh I Bhatt,,,,,,,,,,,,,,,,
195,Impact of Histological Variants on Clinical Outcomes of Patients with Upper Urinary Tract Urothelial Carcinoma,http://www.siucongress.org/eipdf/siu2012Abstract00517.pdf,Michael Rink,Brian D. Robinson,Eugene K. Cha,Jens Hansen,Vitaly Margulis,Jay D. Raman,Armin Pycha,Mesut Remzi,Eiji Kikuchi,Karim Bensalah,Wareef Kabbani,Andrea Haitel,Nathalie Rioux-Leclercq,Charles C. Guo,Wassim Kassouf,Kanishka Sircar,Yair Lotan,Pierre I. Karakiewicz,Douglas S. Scherr,Shahrokh F. Shariat
196,Pathological Nodal Staging Scores for Bladder Cancer: A Decision Tool for Adjuvant Therapy After Radical Cystectomy,http://www.siucongress.org/eipdf/siu2012Abstract00518.pdf,Michael Rink,Behfar Ehdaie,Jens Hansen,Marko Babjuk,Axel S. Merseburger,Robert S. Svatek,Eugene K. Cha,Evanguelos Xylinas,Giacomo Novara,Pierre I. Karakiewicz,Siamak Daneshmand,Yair Lotan,Wassim Kassouf,Hans-Martin Fritsche,Margit Fisch,Guru Sonpavde,Douglas S. Scherr,Mithat Gonen,Shahrokh F. Shariat,
197,Time to Disease Recurrence is a Predictor of Cancer-Specific Mortality After Radical Nephroureterectomy,http://www.siucongress.org/eipdf/siu2012Abstract00519.pdf,Michael Rink,Daniel Sjoberg,Evi Comploj,Vitaly Margulis,Evanguelos Xylinas,Richard K. Lee,Jens Hansen,Eugene K. Cha,Jay D. Raman,Mesut Remzi,Karim Bensalah,Giacomo Novara,Surena F. Matin,Felix K. Chun,Eiji Kikuchi,Wassim Kassouf,Juan I. Martinez-Salamanca,Yair Lotan,Christian Seitz,Shahrokh F. Shariat
198,Loss of SPINK1 Expression in Urothelial Carcinoma of the Bladder Is Associated with Unfavorable Outcome After Radical Cystectomy,http://www.siucongress.org/eipdf/siu2012Abstract00520.pdf,Michael Rink,Juan M. Mosquera,Björn Volkmer,Evanguelos Xylinas,Kyung Park,Eugene K. Cha,Brian D. Robinson,Richard Hautmann,Douglas S. Scherr,Margit Fisch,Mark Rubin,Felix K. Chun,Rainer Küfer,Shahrokh F. Shariat,,,,,,
199,"Bartolomew Gizis (1866-1941): First Professor of Urology at Athens University
",http://www.siucongress.org/eipdf/siu2012Abstract00521.pdf,Apostolos Rempelakos,E Poulakou-Rebelakou,C Tsiamis,E Koutsiaris,,,,,,,,,,,,,,,,
200,The 80th Anniversary of the Greek Urologic Association,http://www.siucongress.org/eipdf/siu2012Abstract00522.pdf,Apostolos Rempelakos,C Tsiamis,M Chrisofos,C Alamanis,E Poulakou-Rebelakou,,,,,,,,,,,,,,,
201,Increasing Day-Case Procedures to Reduce Ward Congestion in a Developing Country: Experience of a Urology Unit,http://www.siucongress.org/eipdf/siu2012Abstract00523.pdf,Chukwudi Okorie,Louis Pisters,,,,,,,,,,,,,,,,,,
